{
  "id" : "601a8dc4-dee7-48eb-b03f-d02fdf0debd0",
  "title": "ADVANCING LIBRARY EDUCATION: TECHNOLOGICAL INNOVATION AND INSTRUCTIONAL DESIGN",
  "publicationDate": "2013-06-01",
  "identifiers": [
    {
      "namespace": "isbn",
      "value": "9781466636897"
    },
    {
      "namespace": "ybp",
      "value": "1"
    }
  ]
}
